# type	name	description
alias	oliver	Go to the home directory.
alias	pc	Go to the iCloud personal-organizer folder.
alias	doc	Go to Documents.
alias	desk	Go to Desktop.
alias	dev	Go to the local dev folder.
alias	down	Go to Downloads.
alias	projects	Go to the projects folder.
alias	cdp	Copy the current directory path to the clipboard.
alias	reloadterm	Reload the current zsh config in this terminal.
alias	fixdock	Restart the macOS Dock process.
alias	kp	Kill processes listening on a TCP port, for example kp 8080.
alias	info	Show a forge machine/system health snapshot.
alias	inf	Shortcut for info.
alias	help	Open the forge command picker for aliases and scripts.
alias	port-release	Port a commit onto a release branch by creating a local cherry-pick branch.
alias	prl	Shortcut for port-release.
alias	web	Open a configured web entry in the preferred browser; use web change to switch browser.
alias	winappclean	Delete Parallels Windows app shortcuts except Visual Studio.app.
alias	vpn	Start a configured VPN connection from forge state/secrets.
alias	dvpn	Disconnect the active VPN connection.
alias	vpns	Show whether an openconnect VPN connection is active.
alias	eject-all	Eject external volumes with forge safety exclusions and confirmation.
alias	ejectall	Shortcut for eject-all.
alias	ea	Short shortcut for eject-all.
alias	hdd-clean	Find old large files by extension and delete them after confirmation.
alias	hc	Shortcut for hdd-clean.
alias	binclear	Remove bin and debug directories from the current tree.
alias	al	Open the alias finder and copy the selected alias name.
alias	a	Shortcut for al.
alias	workset	Switch the active SQL Docker data and snapshot storage paths.
alias	ws	Shortcut for workset.
alias	workinfo	Show the current active SQL Docker and snapshot storage paths.
alias	wi	Shortcut for workinfo.
alias	ardis-migrate	Run Ardis migrations against a selected local SQL database.
alias	am	Shortcut for ardis-migrate.
alias	ram	Run Ardis migrations against a database on a configured remote SQL Server target.
alias	ardis-patch	Apply, remove, or inspect configured Ardis code patches.
alias	ap	Shortcut for ardis-patch.
alias	ardis-complete	Complete Ardis planning/activity data over a selected date range.
alias	ac	Shortcut for ardis-complete.
alias	perf-cache-reset	Clear Perform client cache artifacts.
alias	pcr	Shortcut for perf-cache-reset.
alias	publish-tt	Build the Timetrack solution, then build and push its Docker image.
alias	publish-te	Build the Tools Extensions solution, then build and push its Docker image.
alias	publish-perf-local	Interactively publish and start a selected Perform branch in a local Portainer-style Docker stack.
alias	genopenapi	Regenerate the Perform OpenAPI JSON and TypeScript client.
alias	goa	Shortcut for genopenapi.
alias	genopenapitimetrack	Regenerate the TimeTrack OpenAPI JSON and TypeScript client.
alias	organizer	Organize configured folders by extension rules from work-state.
alias	org	Shortcut for organizer.
alias	o	Short shortcut for organizer.
alias	dotnet-clean	Empty bin folders under the current tree.
alias	dnc	Shortcut for dotnet-clean.
alias	clean	Delete contents of selected configured cleanup targets.
alias	present	Set external display presentation resolution/mode.
alias	prs	Shortcut for present.
alias	convert-mov	Convert a selected .mov in the current folder to a readable, high-quality GIF (half-res, ffmpeg+gifski); use -n to name output, -o to drop near-duplicate frames (smaller GIF).
alias	patch	Apply, remove, or inspect intervention patches.
alias	p	Shortcut for patch.
alias	pr	Remove an applied patch intervention.
alias	stio	Copy or move a selected local file/folder to a station destination, replacing same-name targets.
alias	sio	Shortcut for stio.
alias	h2c	Sync Hades changes up to Cerber.
alias	c2h	Sync Cerber changes down to Hades.
alias	h2c-preview	Preview what would sync from Hades up to Cerber.
alias	c2h-preview	Preview what would sync from Cerber down to Hades.
alias	perf-to-cerber	Sync the Perform profile from Hades up to Cerber.
alias	perf-from-cerber	Sync the Perform profile from Cerber down to Hades.
alias	perf-to-cerber-preview	Preview the Perform sync from Hades up to Cerber.
alias	perf-from-cerber-preview	Preview the Perform sync from Cerber down to Hades.
alias	gs	Show git working tree status.
alias	gco	Check out a git branch or path.
alias	gp	Pull from the configured git remote.
alias	gfo	Fetch updates from origin.
alias	gpu	Push the current branch to its configured remote.
alias	gpo	Publish the current local branch to origin with upstream; fails if the remote branch already exists.
alias	gb	List or manage git branches.
alias	switch	Interactively switch git branches.
alias	sw	Shortcut for switch.
alias	gbd	Delete local git branches matching a pattern.
alias	gdel	Delete local git branches containing a keyword.
alias	branch-clean	Preview or delete local branches by safe prefix.
alias	bc	Shortcut for branch-clean.
alias	dps	List running Docker containers.
alias	dcu	Start the current docker compose stack.
alias	dcd	Stop and remove the current docker compose stack.
alias	dba	Administer a local SQL database: offline/online, drop, recovery, shrink.
alias	dbs	Start stopped Docker containers, launching Docker Desktop if needed.
alias	dbu	Upload a selected .bak from the current folder into the SQL container.
alias	dbr	Restore a selected .bak into the forge SQL Server container.
alias	dbsn	Create a SQL backup snapshot from a selected database.
alias	rdbsn	Create a backup from a configured remote SQL Server target.
alias	rdbr	Restore a snapshot back into a remote SQL Server, overriding an existing database or cloning into a new one with mdf/ldf collision protection.
alias	rdown	Download a remote .bak backup to a selected local destination.
alias	rup	Upload a local .bak backup to a selected remote destination.
alias	dbc	Clear SQL databases; default hard mode removes container/data after typed confirmation.
alias	dbo	Run configured SQL table cleanup and shrink; data loss is possible.
alias	dbfix	Run SQL fix scripts from the repo sqls folder against a chosen database.
alias	sdb	Switch the active appsettings connection string for a configured project.
alias	sqlexec	Run selected .sql files against a chosen connection/database.
alias	se	Shortcut for sqlexec.
alias	script-run	Run selected .sql files from the current folder against a chosen SQL connection.
alias	sr	Select one or more .sql files from the current folder, choose a SQL connection, then run them in order after confirmation.
alias	forge	Go to the mac-forge repo root.
alias	work	Go to the main work folder.
alias	perf	Go to the Ardis Perform repo.
alias	timetrack	Go to the Ardis Timetrack repo.
alias	tt	Shortcut for timetrack.
alias	ttc	Go to the Ardis Timetrack client folder.
alias	ttclient	Go to the Ardis Timetrack client folder.
alias	ttmd	Go to the Ardis Timetrack migrations database folder.
alias	perfclient	Go to the Ardis Perform Angular client.
alias	perfdev	Go to the Ardis Perform DEV worktree.
alias	perf228	Go to the Ardis Perform 228 worktree.
alias	perf230	Go to the Ardis Perform 230 worktree.
alias	perfclient230	Go to the Ardis Perform 230 Angular client.
alias	gpt	Go to the Ardis Tools Extensions repo.
alias	gptbin	Go to the Ardis Utils debug build output folder.
alias	lc	Go to the Ardis local connector repo.
alias	localconnector	Go to the Ardis local connector repo.
alias	fn	Go to the macOS Frontnotes project.
alias	bl	Go to the BookingLounge project.
alias	meerkat	Go to the Meerkat project.
alias	rooted	Go to the Rooted project.
alias	aiwk	Go to the Alice in Wonder Kitchen project.
alias	clients	Go to shared SQL client backup/storage folder.
alias	invoice	Go to the TNI invoice project.
alias	inv	Shortcut for invoice.
alias	ti	Shortcut for invoice.
alias	borg	Go to the borg dev folder.
alias	perflog	Go to Perform output logs.
alias	andi-notes	Go to the Obsidian Andi notes folder.
alias	an	Shortcut for andi-notes.
alias	notes	Shortcut for andi-notes.
alias	vsql	Go to shared SQL storage.
alias	cloudforge	Go to the iCloud forge folder.
alias	snapshots	Go to shared SQL Docker snapshots.
alias	snap	Shortcut for snapshots.
alias	snapdel	Delete everything in the shared snapshots folder; no prompt.
alias	locsql	Go to the local SQL folder.
alias	lcsql	Shortcut for locsql.
alias	locsnapshots	Go to local SQL snapshots.
alias	lcsnaphots	Typo-compatible shortcut for locsnapshots.
alias	lcsnap	Shortcut for locsnapshots.
alias	lcs	Short shortcut for locsnapshots.
alias	lcsnapdel	Delete everything in local SQL snapshots; no prompt.
alias	shared	Go to the shared mounted volume.
alias	cloud	Go to the iCloud Drive root.
alias	gdrive	Go to the Google Drive My Drive folder.
alias	demo	Go to the Cerber-mounted Ardis demo folder.
alias	work-cerb	Go to the Cerber-mounted work volume.
alias	copilot	Run GitHub Copilot CLI.
alias	aiusage	Show local agent/API usage stats.
alias	dela	Delete everything in the current directory; no prompt.
alias	perflogclean	Delete all files in Perform output logs; no prompt.
alias	screenshotclean	Delete PNG screenshots from Desktop; no prompt.
alias	rmc	SSH into MasterChief.
alias	rmcr	SSH into MasterChief over Tailscale.
alias	rth	SSH into Thanatos.
alias	rthr	SSH into Thanatos over Tailscale.
alias	rt	Shortcut for rth.
alias	showeth	Show network hardware ports and their current IP addresses.
alias	mcshutdown	Force shutdown MasterChief over SSH.
alias	thshutdown	Force shutdown Thanatos over SSH.
alias	tsshutdown	Shortcut for thshutdown.
alias	mcsleep	Put MasterChief into sleep/modern standby over SSH.
alias	ms	Shortcut for mcsleep.
alias	tssleep	Put Thanatos into sleep over SSH.
alias	thsleep	Shortcut for tssleep.
alias	ts	Shortcut for tssleep.
alias	tshut	Shortcut for thshutdown.
alias	thshut	Shortcut for thshutdown.
alias	mcboot	Wake MasterChief with Wake-on-LAN.
alias	mcbt	Shortcut for mcboot.
alias	mb	Short shortcut for mcboot.
alias	thboot	Wake Thanatos with Wake-on-LAN.
alias	tboot	Shortcut for thboot.
alias	thb	Shortcut for thboot.
alias	rider	Open JetBrains Rider.
alias	aliases	Print the alias file.
alias	link-dotfiles	Link Linux dotfiles into place.
alias	ldf	Shortcut for link-dotfiles.
alias	workspace-primary	Load the primary Linux workspace layout.
alias	wp	Shortcut for workspace-primary.
alias	display	Set Linux display scaling.
alias	mnthadesw	Mount the Hades work share on Linux.
alias	mnthw	Shortcut for mnthadesw.
alias	umnthadesw	Unmount the Hades work share on Linux.
alias	umnthw	Shortcut for umnthadesw.
alias	thbt	Shortcut for thboot.
script	aliases	Open the alias finder and copy the selected shortcut.
script	ardis-complete	Complete Ardis planning/activity data over a selected date range.
script	ardis-migrate	Run Ardis migrations against a selected local SQL database.
script	bin-clear	Remove bin and debug directories from the current tree.
script	branch-delete	Delete local git branches matching a pattern.
script	branch-local-clean	Preview or delete local branches by safe prefix.
script	clean	Delete contents of selected configured cleanup targets.
script	convert-mov	Convert a selected .mov in the current folder to a readable, high-quality GIF (half-res, ffmpeg+gifski); use -n to name output, -o to drop near-duplicate frames (smaller GIF).
script	db-admin	Administer a local SQL database: offline/online, drop, recovery, shrink.
script	db-clear	Clear SQL databases; default hard mode removes container/data after typed confirmation.
script	db-fix	Run SQL fix scripts from the repo sqls folder against a chosen database.
script	db-optimize	Run configured SQL table cleanup and shrink; data loss is possible.
script	db-remote-backup	Create a backup from a configured remote SQL Server target.
script	db-remote-download	Download a remote .bak backup to a selected local destination.
script	db-remote-upload	Upload a local .bak backup to a selected remote destination.
script	db-restore	Restore a selected .bak into the forge SQL Server container.
script	db-snapshot	Create a SQL backup snapshot from a selected database.
script	db-upload-bak	Upload a selected .bak from the current folder into the SQL container.
script	docker-start	Start stopped Docker containers, launching Docker Desktop if needed.
script	dotnet-clean	Empty bin folders under the current tree.
script	dvpn	Disconnect the active VPN connection.
script	vpn-status	Show whether an openconnect VPN connection is active.
script	eject-all	Eject external volumes with forge safety exclusions and confirmation.
script	forge	Shared forge runtime; usually sourced by other scripts.
script	gen-open-api	Regenerate the Perform OpenAPI JSON and TypeScript client.
script	gen-open-api-timetrack	Regenerate the TimeTrack OpenAPI JSON and TypeScript client.
script	git-del	Delete local git branches containing a keyword.
script	git-switch	Interactively switch git branches.
script	hdd-clean	Find old large files by extension and delete them after confirmation.
script	help	Open the forge command picker for aliases and scripts.
script	info	Show a forge machine/system health snapshot.
script	mcboot	Wake MasterChief with Wake-on-LAN.
script	mcsleep	Put MasterChief into sleep/modern standby over SSH.
script	organizer	Organize configured folders by extension rules from work-state.
script	patch	Apply, remove, or inspect intervention patches.
script	perform-cache-reset	Clear Perform client cache artifacts.
script	perform-cerber-sync	Sync configured work profiles between Hades and Cerber.
script	perform-prep	Prepare Perform build output dependencies.
script	port-release	Port a commit onto a release branch by creating a local cherry-pick branch.
script	present	Set external display presentation resolution/mode.
script	sql-execute	Run selected .sql files against a chosen connection/database.
script	script-run	Run selected .sql files from the current folder against a chosen SQL connection.
script	station-io	Copy or move a selected local file/folder to a station destination, replacing same-name targets.
script	switch-db	Switch the active appsettings connection string for a configured project.
script	thboot	Wake Thanatos with Wake-on-LAN.
script	thsleep	Put Thanatos into sleep over SSH.
script	vpn	Start a configured VPN connection from forge state/secrets.
script	web	Open a configured web entry in the preferred browser; use web change to switch browser.
script	win-shortcut-clean	Delete Parallels Windows app shortcuts except Visual Studio.app.
script	work	Switch or inspect the active SQL Docker data and snapshot storage paths.
alias	v1sn	Create a .bak snapshot of a vps1 database into the vps1 snapshots folder.
alias	vps1-snapshot	Long form of v1sn: create a .bak snapshot of a vps1 database.
alias	v1r	Restore a .bak from the vps1 snapshots folder into the vps1 SQL Server.
alias	vps1-restore	Long form of v1r: restore a vps1 snapshot into the vps1 SQL Server.
alias	v1down	Download a vps1 .bak snapshot to a local directory.
alias	vps1-download	Long form of v1down: download a vps1 .bak snapshot locally.
alias	v1up	Upload a local .bak into the vps1 snapshots folder for later restore.
alias	vps1-upload	Long form of v1up: upload a local .bak into the vps1 snapshots folder.
alias	rdown-to-v1	Relay a remote .bak from the portainer share straight to vps1 snapshots without touching the Mac SSD.
alias	vps1-relay-download	Long form of rdown-to-v1: stream a remote .bak from the share to vps1 with no local copy.
alias	v1drop	Drop live user database(s) on vps1 (multi-select, confirm with 'delete').
alias	vps1-drop	Long form of v1drop: drop live user database(s) on vps1.
alias	v1sndrop	Delete .bak snapshot file(s) from the vps1 snapshots folder (multi-select).
alias	vps1-snapshot-drop	Long form of v1sndrop: delete vps1 .bak snapshot file(s).
alias	v1am	Run Ardis migrations against a database on vps1.
alias	vps1-migrate	Long form of v1am: run Ardis migrations against a vps1 database.
alias	v1list	List all installed databases and all available snapshots on vps1.
alias	vps1-list	Long form of v1list: list vps1 databases and snapshots.
alias	v1opt	Optimize a vps1 database: set recovery SIMPLE and shrink log/data files to reclaim disk (best-effort, no data deleted).
alias	vps1-optimize	Long form of v1opt: shrink/optimize a vps1 database to reduce its disk footprint.
alias	vps1-status	Show vps1 host health plus storage per app keyword (web dirs + databases), endpoints, CPU, and recent history.
alias	v1-bl-publish	Build and publish the BookingLounge API to a vps1 endpoint (development, or gated production: main + clean tree).
alias	vps1-bl-publish	Long form of v1-bl-publish: publish the BookingLounge API to a vps1 endpoint.
alias	v1-bl-tunnel-up	Open the SSH tunnel so localhost:5081 reaches the private BookingLounge dev API on vps1.
alias	v1-bl-tunnel-down	Close the BookingLounge dev API SSH tunnel (localhost:5081).
alias	v1-meerkat-tunnel-up	Open the SSH tunnel so localhost:5281 reaches the private Meerkat dev API on vps1.
alias	v1-meerkat-tunnel-down	Close the Meerkat dev SSH tunnel (localhost:5281).
alias	v1-meerkat-tunnel-status	Show whether the Meerkat dev SSH tunnel is up (localhost:5281) + dev health.
alias	meerkat-enroll	SSH into vps1 and print the current Meerkat direct enrollment string using sudo.
alias	v1-tally-tunnel-up	Open the SSH tunnel so localhost:5181 reaches the private Tally dev API on vps1 (needed by the macOS Debug build).
alias	v1-tally-tunnel-down	Close the Tally dev API SSH tunnel (localhost:5181).
alias	v1-tally-tunnel-status	Show whether the Tally dev API SSH tunnel is up (localhost:5181) + dev health.
alias	v1-sql-tunnel-up	Open the SSH tunnel so localhost:14333 reaches the private vps1 SQL Server (VS Code: Server = localhost,14333).
alias	v1-sql-tunnel-down	Close the vps1 SQL Server SSH tunnel (localhost:14333).
alias	v1-sql-tunnel-status	Show whether the vps1 SQL Server SSH tunnel is up (localhost:14333).
